{
  "schema": "claude-legal-audit.project-roadmap.v1",
  "packet_version": "1.0.0",
  "as_of": "2026-07-22T21:27:50-04:00",
  "project_identity": {
    "project_id": "CLAO-001",
    "current_name": "Claude for Legal Workflow Sovereignty Audit Lab",
    "authority_root": ".",
    "owner": "repository owner",
    "privacy_class": "public research harness with excluded local private workspace",
    "sovereignty_boundary": "The public repository owns public methods and candidate analysis; both ignored private roots, client data, release decisions, and external systems remain outside its authority."
  },
  "coverage": {
    "roots": [
      ".",
      "upstream/claude-for-legal"
    ],
    "sources": [
      "git working tree",
      "UPSTREAM.lock.json",
      "registry/source-registry.json",
      "registry/claim-registry.json",
      "registry/chunk-policy.json",
      "registry/chunk-registry.json",
      "registry/evidence-graph.json",
      "registry/thesis-map.json",
      "registry/lineage-policy.json",
      "registry/repository-history-capture.json"
    ],
    "fingerprint_inputs": [
      "UPSTREAM.lock.json",
      "registry/argument-mesh.json",
      "registry/claim-registry.json",
      "registry/chunk-policy.json",
      "registry/chunk-registry.json",
      "registry/edge-type-library.json",
      "registry/evidence-graph.json",
      "registry/thesis-map.json",
      "registry/lineage-policy.json",
      "registry/research-radar-watchlist.json",
      "registry/source-registry.json",
      "registry/repository-history-capture.json"
    ],
    "input_fingerprint": "sha256:23048d35fe0a812236eb0e8e592d0ca379f29f760c998dc311dd7db4ab8d2902",
    "unavailable_sources": [
      "Anthropic closed runtime and internal intent",
      "executed law-firm contracts",
      "authorized live telemetry tenant",
      "Anthropic trademark/license permission or cooperative publication",
      "Kirkland primary architecture and executed commercial terms"
    ],
    "gaps": [
      "PR 50 remains captured_incomplete_unknown due to GitHub /files listing ceiling versus detail.changed_files",
      "Closed Anthropic runtime, tenant behavior, retention, and training remain Unknown; no Anthropic Q&A sought",
      "Kirkland primary architecture and contract evidence unavailable; comparative custody claims not pursued",
      "Public release intentionally blocked; independent review waived only for unpublished local end-state"
    ]
  },
  "outcome": "Terminal Local Completion: an evidence-reproducible, privacy-safe, unpublished research system for public Claude-for-Legal materials, with permanent unknowns explicit, Anthropic-cooperative publication not pursued, and release blocked.",
  "non_goals": [
    "Allege current provider secondary use without evidence",
    "Process client, privileged, confidential, sealed, or restricted material",
    "Probe real tenants or people without written authorization",
    "Activate monitoring, contribution intake, publication, or live runtime tests",
    "Rename, relicense, stage, commit, push, or publish without separate human approval"
  ],
  "workstreams": [
    {
      "workstream_id": "CLAO-WS-00",
      "title": "Project control and truth baseline",
      "state": "delivered",
      "research_overlay": "handed-off",
      "bounded_outcome": "Durable machine roadmap, release gate, dependency frontier, acceptance evidence, and verified current baseline.",
      "next_action": "Reopen only when a control contract, release boundary, or dependency changes.",
      "acceptance_evidence": [
        {
          "evidence_id": "ACC-001",
          "description": "Machine project roadmap and validator exist and pass.",
          "status": "passed",
          "evidence_refs": [
            "registry/project-roadmap.json",
            "scripts/validate_roadmap.py",
            "tests/test_roadmap.py"
          ]
        },
        {
          "evidence_id": "ACC-002",
          "description": "Independent roadmap and release red-team completed.",
          "status": "passed",
          "evidence_refs": [
            "docs/ROADMAP_CONTROL_REVIEW.md"
          ]
        }
      ],
      "blocker_ids": [],
      "human_gate_ids": [],
      "stop_conditions": [
        "Stop on schema failure, authority inversion, hidden WIP, or invalid lifecycle state."
      ]
    },
    {
      "workstream_id": "CLAO-WS-01",
      "title": "Pinned static audit",
      "state": "delivered",
      "research_overlay": "handed-off",
      "bounded_outcome": "Complete deterministic inventory, URL index, pattern matches, balanced worklists, hashes, and semantic coverage receipts for the pinned upstream commit.",
      "next_action": "Reopen only if the pinned upstream commit changes or an evidence-integrity defect is found.",
      "acceptance_evidence": [
        {
          "evidence_id": "ACC-003",
          "description": "Pinned upstream commit verified.",
          "status": "passed",
          "evidence_refs": [
            "UPSTREAM.lock.json",
            "git -C upstream/claude-for-legal rev-parse HEAD"
          ]
        },
        {
          "evidence_id": "ACC-004",
          "description": "Inventory, URL index, pattern matches, worklists, and hashes generated.",
          "status": "passed",
          "evidence_refs": [
            "results/inventory.json: 315 files and 49365 lines",
            "results/url-index.csv: 162 URLs",
            "results/matches.jsonl: 4481 validated records",
            "results/worklists/summary.json: six balanced worklists",
            "results/SHA256SUMS"
          ]
        },
        {
          "evidence_id": "ACC-005",
          "description": "Every text file receives bounded semantic review and an independent coverage receipt.",
          "status": "passed",
          "evidence_refs": [
            "results/semantic-review-attestations.json",
            "results/semantic-coverage-receipt.jsonl: 315 records and 49365 lines",
            "results/coverage.csv: 315 reviewed records",
            "results/semantic-coverage-round-1.md",
            "independent coverage recheck: PASS"
          ]
        }
      ],
      "blocker_ids": [],
      "human_gate_ids": [],
      "stop_conditions": [
        "Stop if the checkout SHA drifts or any worker requests private or live-system data."
      ]
    },
    {
      "workstream_id": "CLAO-WS-02",
      "title": "Repository archaeology",
      "state": "delivered",
      "research_overlay": "handed-off",
      "bounded_outcome": "Commit-, pull-request-, issue-, and release-level public history with exact SHAs, timestamps, hashes, diffs, and bounded strategy-change hypotheses.",
      "next_action": "Terminal for capturable public PR scope. Reopen only if the public PR index or capture contract changes. PR 50 remains explicit incomplete unknown.",
      "acceptance_evidence": [
        {
          "evidence_id": "ACC-006",
          "description": "History manifest records exact public identifiers, hashes, capture state, and gaps.",
          "status": "passed",
          "evidence_refs": [
            "registry/repository-history-capture.json",
            "results/pr-commit-diff-linkage.json",
            "tests/test_pr_capture.py",
            "results/history-local-snapshot.json",
            "results/history-capture-completeness-receipt.json",
            "scripts/build_history_capture_receipt.py --check"
          ]
        }
      ],
      "blocker_ids": [],
      "human_gate_ids": [],
      "stop_conditions": [
        "Stop on source-rights uncertainty, incomplete pagination presented as complete, or unverifiable deleted history."
      ]
    },
    {
      "workstream_id": "CLAO-WS-03",
      "title": "Source reproducibility",
      "state": "delivered",
      "research_overlay": "handed-off",
      "bounded_outcome": "Repair revision bindings and exact locators for every load-bearing source and candidate claim.",
      "next_action": "Terminal for best-available locator or explicit unknown/quarantine/retired claim boundaries. Reopen only on new registered primary sources.",
      "acceptance_evidence": [
        {
          "evidence_id": "ACC-007",
          "description": "Every active claim has exact registered locators where available, or an explicit blocked/unknown/quarantined/retired boundary with repair note.",
          "status": "passed",
          "evidence_refs": [
            "registry/source-registry.json",
            "registry/claim-registry.json"
          ]
        }
      ],
      "blocker_ids": [],
      "human_gate_ids": [],
      "stop_conditions": [
        "Never promote a claim to reviewed from source count, analogy, or model agreement."
      ]
    },
    {
      "workstream_id": "CLAO-WS-04",
      "title": "Source-aware chunking",
      "state": "delivered",
      "research_overlay": "handed-off",
      "bounded_outcome": "Deterministic v2 static-file chunks preserve every pinned Git-blob byte, full SHA-256 identity preimages, line hints, provenance, reconstruction, and inverse adjacency; PR and web kinds remain gated off.",
      "next_action": "Reopen only to activate pr_file_record or web_capture_span after a separate capture contract and parity suite pass.",
      "acceptance_evidence": [
        {
          "evidence_id": "ACC-008",
          "description": "Stable chunk IDs, lossless reconstruction, citation round-trip, and change-aware adversarial fixtures pass.",
          "status": "passed",
          "evidence_refs": [
            "registry/chunk-policy.json",
            "registry/chunk-registry.json",
            "registry/chunk-id-migration.json",
            "tests/test_chunk_registry.py",
            "scripts/build_chunk_registry.py --check --verify-reconstruction"
          ]
        }
      ],
      "blocker_ids": [],
      "human_gate_ids": [],
      "stop_conditions": [
        "Do not optimize chunk size without a declared retrieval task and benchmark."